timestamp,author,content,cleaned_content,sentiment
2025-02-28 03:18:59+00:00,CryptoAlpha,"BIG CRYPTO NEWS:  THORChain in crisis? Lead dev is reportedly leaving, and prominent X user TCB (
@1984_is_today
) warns he may exit too unless North Korea-linked transactions are blocked. He argues THORChain isn’t decentralized enough to resist regulation like ETH or BTC.",big crypto news thorchain in crisis lead dev is reportedly leaving and prominent x user tcb warns he may exit too unless north korealinked transactions are blocked he argues thorchain isnt decentralized enough to resist regulation like eth or btc,negative
2025-02-28 03:10:28+00:00,Iron Man,The SEC's stance on cryptocurrency regulation remains uncertain. Do you think regulatory clarity will help or hinder mass adoption Share your perspective #Crypto #Blockchain #Bitcoin,the secs stance on cryptocurrency regulation remains uncertain do you think regulatory clarity will help or hinder mass adoption share your perspective,neutral
2025-02-28 03:07:22+00:00,FartFy News,"Michael Saylor, co-founder of MicroStrategy, presented a Digital Assets Framework to the House Financial Services Committee. He aims to position the U.S. as a leader in Bitcoin and cryptocurrency regulation. #Bitcoin #Crypto #Regulation",michael saylor cofounder of microstrategy presented a digital assets framework to the house financial services committee he aims to position the us as a leader in bitcoin and cryptocurrency regulation,positive
2025-02-28 01:35:13+00:00,Altcoin Jack,"Illicit crypto trades may have topped $51B in 2024, with criminals switching from Bitcoin to stablecoins. The crackdown is coming. Could this trigger unexpected regulation on USDT and USDC?",illicit crypto trades may have topped $51b in 2024 with criminals switching from bitcoin to stablecoins the crackdown is coming could this trigger unexpected regulation on usdt and usdc,negative
2025-02-28 00:50:39+00:00,Crypr0xi,"Here’s what happened in crypto today  Need to know what happened in crypto today? Here is the latest news on daily trends and events impacting Bitcoin price, blockchain, DeFi, NFTs, Web3 and crypto regulation.",heres what happened in crypto today need to know what happened in crypto today here is the latest news on daily trends and events impacting bitcoin price blockchain defi nfts web3 and crypto regulation,neutral
2025-02-27 23:18:08+00:00,Sigma Degen Alpha, Big news! The Texas Senate is considering a Bitcoin reserve law!  Could this be a turning point for crypto regulation? What are your thoughts on adopting Bitcoin at a state level?  #Bitcoin #CryptoFuture,big news the texas senate is considering a bitcoin reserve law could this be a turning point for crypto regulation what are your thoughts on adopting bitcoin at a state level,neutral
2025-02-27 22:19:21+00:00,Singh Bains,"Crypto regulation will be different for 
1. Layer 1 tokens 
2. Layer 2 tokens 
3. Meme tokens. 
It will be regulated to stay unregulated. It will be huge for crypto. #XRP #BTC.Trust in what you do and stick with it. Crypto   to the moon.",crypto regulation will be different for 1 layer 1 tokens 2 layer 2 tokens 3 meme tokens it will be regulated to stay unregulated it will be huge for crypto trust in what you do and stick with it crypto to the moon,neutral
2025-02-27 21:56:20+00:00,Mercex,"The recent shift of the crypto industry towards the GOP raises eyebrows as they navigate political alliances. While donations flow to both parties, what could this mean for the future of crypto regulation?  #CryptoPolitics #Bitcoin #Mercex #MercexNews",the recent shift of the crypto industry towards the gop raises eyebrows as they navigate political alliances while donations flow to both parties what could this mean for the future of crypto regulation,neutral
2025-02-27 21:30:01+00:00,Crypto Inferno," CRYPTO NEWS ALERT 

 SEC: MEM COINLER ARE GENERALLY NOT CONSIDERED SECURITIES UNDER FEDERAL LAW

 SEC: MEM COINLER ARE GENERALLY NOT CONSIDERED SECURITIES UNDER FEDERAL LAW

Source: coinotag",crypto news alert sec mem coinler are generally not considered securities under federal law sec mem coinler are generally not considered securities under federal law source coinotag,neutral
2025-02-27 21:13:23+00:00,Shadow,"Coinbase and the SEC dismiss lawsuit with prejudice! A major legal battle comes to an end.
#Coinbase #SEC #CryptoNews #Regulation $BTC $ETH #CryptoMarket",coinbase and the sec dismiss lawsuit with prejudice a major legal battle comes to an end $btc $eth,neutral
2025-02-27 21:09:28+00:00,Simple Crypto,North Korean Lazarus Group evolves into crypto's supervillain with high-profile exchange hacks totaling billions. The greatest security challenge isn't regulation - it's nation-state actors operating without consequences as $BTC sits at $83.4K.,north korean lazarus group evolves into cryptos supervillain with highprofile exchange hacks totaling billions the greatest security challenge isnt regulation its nationstate actors operating without consequences as $btc sits at $834k,neutral
2025-02-27 19:29:07+00:00,SACH," Trump’s executive order backs responsible #crypto growth.
 Bipartisan push for regulation; framework in 6-12 months.
 States like FL & TX embrace Bitcoin.
 Clear rules = consumer protection & investment.
 U.S. must act or risk losing blockchain leadership.
#BTC #Crypto",trumps executive order backs responsible growth bipartisan push for regulation framework in 612 months states like fl tx embrace bitcoin clear rules consumer protection investment us must act or risk losing blockchain leadership,neutral
2025-02-27 18:38:59+00:00,Musa Ali,"Inside News: Treasury and DOGE Prepare for Crypto Regulation Reset Next Week!  New tax laws and simplified regulations coming for #Bitcoin #Ethereum—will the economy experience a digital explosion?  #Crypt 
@CryptoJelleNL
 @Ashcryptoreal
 @CayptoR15420
 @CayptoR87592
 @cryptocevo",inside news treasury and doge prepare for crypto regulation reset next week new tax laws and simplified regulations coming for will the economy experience a digital explosion,neutral
2025-02-27 18:29:32+00:00,₿roodloper,"CRYPTO BREAKTHROUGH: The SEC is set to dismiss its enforcement action against ConsenSys’ MetaMask. CEO Joe Lubin highlights the need for innovation and regulation to collaborate for a thriving future, boosting Bitcoin’s momentum in the market.",crypto breakthrough the sec is set to dismiss its enforcement action against consensys metamask ceo joe lubin highlights the need for innovation and regulation to collaborate for a thriving future boosting bitcoins momentum in the market,positive
2025-02-27 16:42:13+00:00,LCX Moonboi,#altcoin is all about utility. #MEMECoin go fcuk yourselves together with $btc. Hyped without any practical use cases. I still believe in $LCX and $xrp. The first more than the latter. Go #AltcoinSeason #mica #Regulation #Crypto #lcxcommunity,is all about utility go fcuk yourselves together with $btc hyped without any practical use cases i still believe in $lcx and $xrp the first more than the latter go,neutral
2025-02-27 15:40:30+00:00,Orb," TRENDING IN CRYPTO:

 Michael Saylor inches closer to 500k BTC, just $80M away! (BTC)

 SEC drops investigations into Gemini and TRON—big shift in crypto regulation! (GEMINI, TRON)

 Mask Network’s founder loses $4M in a hack; funds quickly dispersed. 

 Coinbase",trending in crypto michael saylor inches closer to 500k btc just $80m away btc sec drops investigations into gemini and tronbig shift in crypto regulation gemini tron mask networks founder loses $4m in a hack funds quickly dispersed coinbase,neutral
2025-02-27 15:32:17+00:00,Corb,"Something weird is going on in crypto. BlackRock has been moving huge amounts of BTC & ETH to Coinbase, and we’ve seen constant flash crashes wiping out retail traders. Feels like a setup

If Trump follows through on pro-crypto regulation, he’d want to align himself at liquidated",something weird is going on in crypto blackrock has been moving huge amounts of btc eth to coinbase and weve seen constant flash crashes wiping out retail traders feels like a setup if trump follows through on procrypto regulation hed want to align himself at liquidated,neutral
2025-02-27 15:14:44+00:00,systemic bliss,"In past week, the SEC has…

• Dropped lawsuit against Coinbase.
• Closed investigation into OpenSea.
• Dropped investigation into Uniswap.
• Dropped investigation into Gemini.

Imagine if regulation by enforcement never happened, how much further Bitcoin and crypto would be?",in past week the sec has dropped lawsuit against coinbase closed investigation into opensea dropped investigation into uniswap dropped investigation into gemini imagine if regulation by enforcement never happened how much further bitcoin and crypto would be,neutral
2025-02-27 15:08:54+00:00,Евгений Зубарев, Blockchain Association pushes for support of Sen. Ted Cruz's bill to scrap troublesome tax regulation. Let's move towards fairer policies for #BTC and #AI!  #crypto #technology,blockchain association pushes for support of sen ted cruzs bill to scrap troublesome tax regulation lets move towards fairer policies for and,positive
2025-02-27 14:06:37+00:00,amber,"India intensifies crackdown on crypto, seizes $190M in Bitconnect Ponzi scheme probe  #CryptoCommunity #BTC #cryptonews #India #regulation",india intensifies crackdown on crypto seizes $190m in bitconnect ponzi scheme probe,negative
2025-02-27 12:54:37+00:00,LLeonardo Dav,The crypto world is heating up faster than a Karachi summer. Pakistan's crypto council? Big move in regulation. 21Shares sees Bitcoin Catalysts—Nvidia earnings and PCE data. Ripple just dropped XRP custody in South Korea like it's going out of style. And Robinhood’s CEO says,the crypto world is heating up faster than a karachi summer pakistans crypto council big move in regulation 21shares sees bitcoin catalystsnvidia earnings and pce data ripple just dropped xrp custody in south korea like its going out of style and robinhoods ceo says,neutral
2025-02-27 11:43:21+00:00,Primus,"Tron's introduction of zero-fee $USDT transfers next week may boost adoption. Meanwhile, $BTC approaches its $78K CME gap, forming a new one at $93. 5K. Pakistan's planned crypto council is expected to oversee policy and regulation, potentially impacting market growth.",trons introduction of zerofee $usdt transfers next week may boost adoption meanwhile $btc approaches its $78k cme gap forming a new one at $93 5k pakistans planned crypto council is expected to oversee policy and regulation potentially impacting market growth,positive
2025-02-27 10:15:16+00:00,Bpay News,"The Spring of Crypto Regulation: A Look at Recent SEC Settlements and Dismissals

The U.S. SEC has vindicated ""false and wrongful cases"", and cryptocurrencies have ushered in the dawn of regulation.
#Bitcoin $BTC",the spring of crypto regulation a look at recent sec settlements and dismissals the us sec has vindicated false and wrongful cases and cryptocurrencies have ushered in the dawn of regulation $btc,neutral
2025-02-27 09:22:54+00:00,cryto men,"Regulations Incoming 
Governments are tightening their grip on crypto, but is it good or bad? Some say regulation = legitimacy, others fear control. One thing’s certain: the game is changing. Are you ready? 
#Bitcoin #CryptoRegulation #FutureOfFinance",regulations incoming governments are tightening their grip on crypto but is it good or bad some say regulation legitimacy others fear control one things certain the game is changing are you ready,neutral
2025-02-27 09:22:05+00:00,El Crypto Hero," January 2025 saw the crypto market peak under pro-crypto policies. With 47 new crypto ETF filings and rising institutional adoption, the stage is set for growth. Eyes on Bitcoin, Ethereum, and Solana for 2025! #Crypto #Investment #Regulation #BTC #ETH #SOL",january 2025 saw the crypto market peak under procrypto policies with 47 new crypto etf filings and rising institutional adoption the stage is set for growth eyes on bitcoin ethereum and solana for 2025,positive
2025-02-27 08:59:32+00:00,Patty Pasadena,"Bitcoin's white paper flaw: it covers miners but not theft. Theft’s plagued crypto since. Industry’s too dumb to fix it, chasing external regulation instead of building in solutions. 
@saylor
 @elonmusk
 @VitalikButerin
#Bitcoin #CryptoTheft #Blockchain #FixCrypto",bitcoins white paper flaw it covers miners but not theft thefts plagued crypto since industrys too dumb to fix it chasing external regulation instead of building in solutions,neutral
2025-02-27 08:43:54+00:00,Agent Smith,"As spot Bitcoin ETFs and infrastructure scaling take center stage, the question remains: will regulation propel or stifle crypto adoption?",as spot bitcoin etfs and infrastructure scaling take center stage the question remains will regulation propel or stifle crypto adoption,neutral
2025-02-27 07:02:46+00:00,Themisforcrypto," Is crypto regulation the wild west of finance?  With countries hopscotching between bans & 'legal tender' tags, the drama's real!  Let's find solutions that protect investors without stifling innovation! What's your take?  #CryptoRegulation #Bitcoin 
@IMFNews
 @FATFNews",is crypto regulation the wild west of finance with countries hopscotching between bans legal tender tags the dramas real lets find solutions that protect investors without stifling innovation whats your take,neutral
2025-02-27 05:33:18+00:00,aipps,"us house committee greenlights crypto regulation simplification. resolution aims to streamline oversight, reduce regulatory burden. could boost innovation and market growth if passed. bullish for $btc $eth and broader crypto ecosystem",us house committee greenlights crypto regulation simplification resolution aims to streamline oversight reduce regulatory burden could boost innovation and market growth if passed bullish for $btc $eth and broader crypto ecosystem,positive
2025-02-27 05:17:05+00:00,Mr Entrepreneur,South Africa leads crypto adoption and regulation in Africa with growing use of $BTC.,south africa leads crypto adoption and regulation in africa with growing use of $btc,neutral
2025-02-27 04:50:55+00:00,owan,"Bitcoin has fallen below the $85,000 threshold, reaching a low of $82,455. This decline is attributed to recent security breaches and regulatory concerns in the crypto space. Investors are advised to stay informed and assess their risk exposure. #Bitcoin #CryptoMarket #Regulation",bitcoin has fallen below the $85000 threshold reaching a low of $82455 this decline is attributed to recent security breaches and regulatory concerns in the crypto space investors are advised to stay informed and assess their risk exposure,negative
2025-02-27 02:34:26+00:00,CRYPTOTAG | Seed Phrase Storage," Stablecoins Take Center Stage in U.S. Senate Hearing  

The first U.S. Digital Assets Subcommittee hearing focused on stablecoins, not Bitcoin. Key takeaways:  
 Calls for clear regulation to prevent misuse  
 Emphasis on monitoring transactions for AML compliance  ",stablecoins take center stage in us senate hearing the first us digital assets subcommittee hearing focused on stablecoins not bitcoin key takeaways calls for clear regulation to prevent misuse emphasis on monitoring transactions for aml compliance,neutral
2025-02-27 01:50:44+00:00,garytest42," The recent global regulatory developments are setting a positive precedent for institutional adoption, fostering a clearer framework that will drive innovation and market confidence in the crypto space. #Regulation #CryptoAdoption #MarketConfidence #ATH #BTC #DJI #RRP #VVV #PY",the recent global regulatory developments are setting a positive precedent for institutional adoption fostering a clearer framework that will drive innovation and market confidence in the crypto space,positive
2025-02-27 01:42:17+00:00,CryptoGPT,"Bitcoin doesn't wait for approval. While the suits keep chasing shadows, remember that in 2010, you could buy a pizza for 10,000 BTC. Now, it's a global powerhouse. 

Keep your coins close; freedom thrives where regulation fears to tread.",bitcoin doesnt wait for approval while the suits keep chasing shadows remember that in 2010 you could buy a pizza for 10000 btc now its a global powerhouse keep your coins close freedom thrives where regulation fears to tread,neutral
2025-02-27 00:03:52+00:00,Themisforcrypto,"Crypto is a rollercoaster, and regulators are tightening the seatbelts!  Ready for the ride? Increased oversight means more trust, but watch for those market dips! How do you feel about balancing innovation with regulation?  #CryptoRegulations #InvestSmart #Bitcoin",crypto is a rollercoaster and regulators are tightening the seatbelts ready for the ride increased oversight means more trust but watch for those market dips how do you feel about balancing innovation with regulation,neutral
2025-02-26 23:07:13+00:00,Harmony Algo," SEC drops its investigation into crypto exchange Gemini, per Cameron Winklevoss!  Recent moves also see cases withdrawn against Coinbase, OpenSea, Robinhood & UniSwap, plus talks with Justin Sun. Big shift in crypto regulation?  #Crypto #SEC #Bitcoin #Web3",sec drops its investigation into crypto exchange gemini per cameron winklevoss recent moves also see cases withdrawn against coinbase opensea robinhood uniswap plus talks with justin sun big shift in crypto regulation,negative
2025-02-26 22:38:10+00:00,Harmony Algo, Sen. Lummis says Washington is “on the precipice” of passing #crypto & #stablecoin regulations! Lawmakers aim to finalize bills for Trump’s signature by year-end. Regulation is coming—stay tuned!  #Bitcoin #Blockchain #CryptoRegulation #DeFi #CryptoNews,sen lummis says washington is on the precipice of passing regulations lawmakers aim to finalize bills for trumps signature by yearend regulation is comingstay tuned,neutral
2025-02-26 22:36:39+00:00,Satoshe Nakamoto,"BREAKING: BANK OF AMERICA & RIPPLE $XRP CONFIRMED!  U.S. CRYPTO REGULATION ""COMING SOON"", GOLDEN AGE OF CRYPTO HAS ARRIVED & BITCOIN COLLAPSE EXPLAINED!",breaking bank of america ripple $xrp confirmed us crypto regulation coming soon golden age of crypto has arrived bitcoin collapse explained,neutral
2025-02-26 22:22:55+00:00,Simple Crypto,"Jake Chervinsky just called it: Bitcoin's perfect storm has arrived. Supportive regulation, world-class tech, macroeconomic tailwinds, and TradFi finally waking up. $BTC +4.2% to $68,320 since his tweet this morning.",jake chervinsky just called it bitcoins perfect storm has arrived supportive regulation worldclass tech macroeconomic tailwinds and tradfi finally waking up $btc 42% to $68320 since his tweet this morning,positive
2025-02-26 20:26:27+00:00,Crypto Jee,"We knew regulation would pause the bull run—imo it’s still a bull with a diff peak date

Think of regulation like the black swan event of 2025

In 2020, it was COVID. The world stopped, panic took over, and $BTC nuked to $3K. 

One single gen entry 

Looking back, it was the best",we knew regulation would pause the bull runimo its still a bull with a diff peak date think of regulation like the black swan event of 2025 in 2020 it was covid the world stopped panic took over and $btc nuked to $3k one single gen entry looking back it was the best,neutral
2025-02-26 20:12:43+00:00,MEGBZK,"BREAKING: BANK OF AMERICA & RIPPLE $XRP CONFIRMED!  U.S. CRYPTO REGULATION ""COMING SOON"", GOLDEN AGE OF CRYPTO HAS ARRIVED & BITCOIN COLLAPSE EXPLAINED!",breaking bank of america ripple $xrp confirmed us crypto regulation coming soon golden age of crypto has arrived bitcoin collapse explained,neutral
2025-02-26 20:05:27+00:00,JayFi,"Crypto’s wild ride continues—BTC dips below $89k after a $1.5B Bybit hack shakes the market, but the SEC dropping Uniswap’s case signals a thaw in regulation. XRP’s bleeding, ETH’s holding, and stablecoin talks are heating up. This is our chaos, our freedom—where’s it taking us?",cryptos wild ride continuesbtc dips below $89k after a $15b bybit hack shakes the market but the sec dropping uniswaps case signals a thaw in regulation xrps bleeding eths holding and stablecoin talks are heating up this is our chaos our freedomwheres it taking us,negative
2025-02-26 20:03:38+00:00,caitlynn bascue," The new Trump administration is focusing on crypto policy, aiming to regulate #Altcoin and #BTC. Exciting times ahead in the crypto space!  #cryptonews #regulation",the new trump administration is focusing on crypto policy aiming to regulate and exciting times ahead in the crypto space,neutral
2025-02-26 19:48:14+00:00,FinanceFeeds,"Jack Dorsey’s Block Inc. is in negotiations with New York state regulators over compliance concerns related to its Anti-Money Laundering and Bitcoin programs, according to a recent SEC filing.#jackdorsey #block #regulation #aml #bitcoin #crypto #btc #blockchain",jack dorseys block inc is in negotiations with new york state regulators over compliance concerns related to its antimoney laundering and bitcoin programs according to a recent sec filing,negative
2025-02-26 19:42:50+00:00,FinanceFeeds,"Uniswap Labs, the developer behind Uniswap, announced that the U.S. Securities and Exchange Commission (SEC) officially closed its investigation into the firm without pursuing enforcement action.#uniswap #sec #regulation #dex #crypto #bitcoin #btc #blockchain",uniswap labs the developer behind uniswap announced that the us securities and exchange commission sec officially closed its investigation into the firm without pursuing enforcement action,negative
2025-02-26 17:05:15+00:00,Block TrendX," Should the CFTC regulate memecoins? 

A former CFTC attorney believes the agency should take the lead in regulating memecoins. With their explosive growth & high volatility.

#Crypto #Memecoins #Regulation #Bitcoin",should the cftc regulate memecoins a former cftc attorney believes the agency should take the lead in regulating memecoins with their explosive growth high volatility,neutral
2025-02-26 16:38:07+00:00,Eduarda," Report: SEC officials ordered to reduce cryptocurrency enforcement team size, impacting oversight on #BTC and #NFT markets. Stay tuned for more updates!  #crypto #regulation",report sec officials ordered to reduce cryptocurrency enforcement team size impacting oversight on and markets stay tuned for more updates,negative
2025-02-26 16:29:44+00:00,rockybits,"Crypto market rollercoaster continues!   From Bybit hacks to new lows for Bitcoin, it’s been a wild week.  Plus, DeFi lending faces a crucial moment, and regulation debates heat up. What are YOUR biggest crypto concerns right now? #crypto #bitcoin #defi #regulation",crypto market rollercoaster continues from bybit hacks to new lows for bitcoin its been a wild week plus defi lending faces a crucial moment and regulation debates heat up what are your biggest crypto concerns right now,negative
2025-02-26 16:01:59+00:00,Hulk,"Crypto adoption is rising globally, but some countries ban it. Will governments eventually embrace digital assets, or will regulation slow down innovation? #Crypto #Blockchain #Bitcoin",crypto adoption is rising globally but some countries ban it will governments eventually embrace digital assets or will regulation slow down innovation,neutral
2025-02-26 16:01:30+00:00,Iron Man,"Crypto adoption is rising globally, but some countries ban it. Will governments eventually embrace digital assets, or will regulation slow down innovation? #Crypto #Blockchain #Bitcoin",crypto adoption is rising globally but some countries ban it will governments eventually embrace digital assets or will regulation slow down innovation,neutral
2025-02-26 15:54:20+00:00,Captain America,"Crypto adoption is rising globally, but some countries ban it. Will governments eventually embrace digital assets, or will regulation slow down innovation? #Crypto #Blockchain #Bitcoin",crypto adoption is rising globally but some countries ban it will governments eventually embrace digital assets or will regulation slow down innovation,neutral
2025-02-26 15:52:47+00:00,RWA Pulse - by RWA.io,JUST IN: Institutional OTC crypto trading hit $39B daily due to Bitcoin ETFs and US elections driving adoption. Survey finds 18% expect 100% growth in 2025 with AI tech on the rise. Europe leads demand. 92% plan extra licenses in regulation-friendly countries.,just in institutional otc crypto trading hit $39b daily due to bitcoin etfs and us elections driving adoption survey finds 18% expect 100% growth in 2025 with ai tech on the rise europe leads demand 92% plan extra licenses in regulationfriendly countries,positive
2025-02-26 15:41:42+00:00,AXP," Crypto Market Breaking News – Feb 26, 2025

 Bitcoin (BTC) $87,947 | Ethereum (ETH) $2,442 | BNB $621 – Market stabilizing?
 Bybit hacked – $1.5B in ETH stolen – Security fears rising!
 SEC closes Robinhood investigation – Crypto regulation shift ahead

Will crypto",crypto market breaking news feb 26 2025 bitcoin btc $87947 ethereum eth $2442 bnb $621 market stabilizing bybit hacked $15b in eth stolen security fears rising sec closes robinhood investigation crypto regulation shift ahead will crypto,neutral
2025-02-26 15:25:13+00:00,Logan Prescott,"futures trading hitting crypto like the iphone hit tech in '07. lower volatility, better regulation, easier access for big money. $BTC derivatives bout to change the game fr and you're still early if you're reading this",futures trading hitting crypto like the iphone hit tech in 07 lower volatility better regulation easier access for big money $btc derivatives bout to change the game fr and youre still early if youre reading this,neutral
