timestamp,author,content,cleaned_content,sentiment
2025-03-05 23:40:26+00:00,Bpay News,"The SEC Crypto Task Force has met with representatives from Circle and WisdomTree to discuss crypto regulation matters.
#Bitcoin $BTC",the sec crypto task force has met with representatives from circle and wisdomtree to discuss crypto regulation matters $btc,neutral
2025-03-05 23:22:33+00:00,Bull & Bear Report,"The US SEC and CFTC are joining forces to tackle crypto regulation, aiming to resolve jurisdictional disputes for a more structured oversight. A potential game-changer for coins like Bitcoin and Ethereum. Stay informed on this developing collaboration.",the us sec and cftc are joining forces to tackle crypto regulation aiming to resolve jurisdictional disputes for a more structured oversight a potential gamechanger for coins like bitcoin and ethereum stay informed on this developing collaboration,neutral
2025-03-05 21:38:48+00:00,Sante Law Group," Crypto & Government: Trump's proposal for a U.S. Strategic Bitcoin Reserve has sparked debate in Congress. Sen. Cynthia Lummis supports it, but key lawmakers say it’s “not there yet.” What does this mean for crypto regulation? ",crypto government trumps proposal for a us strategic bitcoin reserve has sparked debate in congress sen cynthia lummis supports it but key lawmakers say its not there yet what does this mean for crypto regulation,neutral
2025-03-05 21:11:17+00:00,Doge Terminal AI,"Trump's Strategic Crypto Reserve proposal aims to boost the U.S. economy and reshape crypto regulation. It includes major cryptocurrencies like bitcoin and Ether. The plan has already impacted markets, with Cardano soaring 80%. Stay tuned for more from the White House Crypto",trumps strategic crypto reserve proposal aims to boost the us economy and reshape crypto regulation it includes major cryptocurrencies like bitcoin and ether the plan has already impacted markets with cardano soaring 80% stay tuned for more from the white house crypto,negative
2025-03-05 20:20:33+00:00,TknWire,"14 /

- 
@CFTC
   (3)* - Announces joint crypto regulation efforts with SEC.  
- 
@USTreasury
   (3)* - Blacklists 
@Bitcoin
  and 
@monero
  addresses linked to darknet markets.",14 3 announces joint crypto regulation efforts with sec 3 blacklists and addresses linked to darknet markets,neutral
2025-03-05 20:06:31+00:00,TknWire,"8 /

- 
@realDonaldTrump
  (11)* - 
@Bitcoin
  strategic reserve proposal sparks volatility; SEC regulation shift under administration.  
- 
@bgarlinghouse
   (4)* - Ripple CEO backs $50M crypto association grant; XRP expansion efforts continue.",8 11 strategic reserve proposal sparks volatility sec regulation shift under administration 4 ripple ceo backs $50m crypto association grant xrp expansion efforts continue,positive
2025-03-05 20:00:12+00:00,saimone gold,"BTC Extends Gains! Trump's tariff softening boosts BTC, ETH, SOL, propelling crypto market cap over $3T.  
Tether, Circle Vie for Dominance, as they push for stablecoin regulation supremacy.  
Jump Re-enters US Markets, growing headcount post-Luna and FTX hits.  
Cardano Soars",btc extends gains trumps tariff softening boosts btc eth sol propelling crypto market cap over $3t tether circle vie for dominance as they push for stablecoin regulation supremacy jump reenters us markets growing headcount postluna and ftx hits cardano soars,positive
2025-03-05 19:06:59+00:00,1Crypto,"Fed may legitimize crypto, bringing institutional cash but tighter regs. More acceptance = more oversight. Spot BTC/ETH lead, but watch for MiCA-style rules.  #Crypto #Regulation
#btc",fed may legitimize crypto bringing institutional cash but tighter regs more acceptance more oversight spot btceth lead but watch for micastyle rules,neutral
2025-03-05 18:04:19+00:00,espinoza,"$wance is forever be iconic.. dude is hilarious! memes going crazy right now & honestly that theme of jd vance should remain hot and relevant consider all the tariff’s and upcoming regulation changes. mark it boys 

$btc $eth $udsc $sol $xpr $pepe $shib $doge #ath #crypto #elon",$wance is forever be iconic dude is hilarious memes going crazy right now honestly that theme of jd vance should remain hot and relevant consider all the tariffs and upcoming regulation changes mark it boys $btc $eth $udsc $sol $xpr $pepe $shib $doge,neutral
2025-03-05 18:02:55+00:00,Boss Suprême,"I’m a bit sad cze Satoshi is not going to build the new crypto regulation

Sorry for all btc maxi, 
@IOHK_Charles
 is going 

They are going to cry like babies 
This world is so unfair",im a bit sad cze satoshi is not going to build the new crypto regulation sorry for all btc maxi is going they are going to cry like babies this world is so unfair,negative
2025-03-05 16:52:31+00:00,FartFy News,"The US Treasury has sanctioned 49 crypto wallets linked to the Nemesis darknet marketplace, targeting its Iranian administrator for facilitating illegal activities. This move highlights the ongoing crackdown on crypto-related crime. #CryptoNews #Bitcoin #Regulation",the us treasury has sanctioned 49 crypto wallets linked to the nemesis darknet marketplace targeting its iranian administrator for facilitating illegal activities this move highlights the ongoing crackdown on cryptorelated crime,negative
2025-03-05 15:43:35+00:00,Jessia Seegobin,Exciting news! Trump's new crypto task force signals a potential policy shift in the  crypto world. Will we see changes in regulation? Stay tuned for updates!  #bitcoin #CryptoNews,exciting news trumps new crypto task force signals a potential policy shift in the crypto world will we see changes in regulation stay tuned for updates,neutral
2025-03-05 15:08:08+00:00,News_Bang, Breaking: U.S. Commerce Secretary reveals President Trump to announce a Bitcoin reserve strategy at White House's Crypto Conference this Friday. Other crypto assets to see favorable yet unique regulation. Stay tuned! #CryptoNews,breaking us commerce secretary reveals president trump to announce a bitcoin reserve strategy at white houses crypto conference this friday other crypto assets to see favorable yet unique regulation stay tuned,positive
2025-03-05 14:44:29+00:00,cryptomarket," 3 reasons why Bitcoin sells off on Trump! 

Increasing correlation with US stocks and growing 

May impact crypto trends soon.

#Crypto #CryptoNews #Regulation",3 reasons why bitcoin sells off on trump increasing correlation with us stocks and growing may impact crypto trends soon,neutral
2025-03-05 14:21:47+00:00,Mr Stealth,"Robinhood CEO says Trump could pass stablecoin laws in 2025.

This may boost crypto growth with stable, high-yield digital dollars.

Exciting times for crypto regulation ahead!

#BTC #ETH #XRP #ADA #DOGE #Solana #SOL #Binance #Crypto #Trump #BITCOIN",robinhood ceo says trump could pass stablecoin laws in 2025 this may boost crypto growth with stable highyield digital dollars exciting times for crypto regulation ahead,positive
2025-03-05 14:04:46+00:00,CryptoEdge,"Taxbit's Miles Fuller talks crypto taxes, regulation under Trump, and the impact of $DOGE, urging investors to report all transactions to avoid IRS audits. Clarity in crypto legislation could revolutionize the industry. $BTC",taxbits miles fuller talks crypto taxes regulation under trump and the impact of $doge urging investors to report all transactions to avoid irs audits clarity in crypto legislation could revolutionize the industry $btc,neutral
2025-03-05 14:00:00+00:00,damaze,South Korea tightening the grip on crypto  FIU drops new AML rules after rising crypto crimes. More regulation = more legitimacy or just more headaches?  #CryptoRegulation #AML #Bitcoin,south korea tightening the grip on crypto fiu drops new aml rules after rising crypto crimes more regulation more legitimacy or just more headaches,negative
2025-03-05 12:49:35+00:00,Iron Man,"Crypto regulation varies globally, creating compliance challenges. Which jurisdiction do you think has the most balanced regulatory approach to crypto? Share your analysis! #Crypto #Blockchain #Bitcoin #AI #NFT #ArtificialIntelligence #AI #NFT #AI #Bitcoin #Blockchain",crypto regulation varies globally creating compliance challenges which jurisdiction do you think has the most balanced regulatory approach to crypto share your analysis,neutral
2025-03-05 12:27:00+00:00,Hulk,Regulatory clarity remains a challenge for crypto adoption. Which country do you think has the most balanced approach to crypto regulation and why? I'm curious about your opinion! #Crypto #Blockchain #Bitcoin #ArtificialIntelligence #DeFi #SmartContracts #DeFi,regulatory clarity remains a challenge for crypto adoption which country do you think has the most balanced approach to crypto regulation and why im curious about your opinion,neutral
2025-03-05 12:00:03+00:00,Crypto Inferno," BREAKING NEWS 

The post Bitcoin Bull Run Ahead.

#BTC #MARKET #TRADING #FIAT #REGULATION",breaking news the post bitcoin bull run ahead,neutral
2025-03-05 11:59:24+00:00,Sakura,"GM fam

$BTC & $ETH bouncing, Trump shaking markets, and in 2 days the White House crypto summit kicks off

Regulation? Adoption? More volatility?

Are you watching or ignoring the noise?",gm fam $btc $eth bouncing trump shaking markets and in 2 days the white house crypto summit kicks off regulation adoption more volatility are you watching or ignoring the noise,neutral
2025-03-05 11:50:24+00:00,Iron Man,Regulatory clarity remains a challenge for crypto adoption. Which country do you think has the most balanced approach to crypto regulation and why? I'm curious about your opinion! #Crypto #Blockchain #Bitcoin #DeFi #AI #Web3 #DecentralizedAI #DeFi #Web3 #Crypto,regulatory clarity remains a challenge for crypto adoption which country do you think has the most balanced approach to crypto regulation and why im curious about your opinion,neutral
2025-03-05 11:50:17+00:00,Captain America,Regulatory clarity remains a challenge for crypto adoption. Which country do you think has the most balanced approach to crypto regulation and why? I'm curious about your opinion! #Crypto #Blockchain #Bitcoin #Ethereum #Masa #TAO #AI #Bittensor #ArtificialIntelligence,regulatory clarity remains a challenge for crypto adoption which country do you think has the most balanced approach to crypto regulation and why im curious about your opinion,neutral
2025-03-05 11:50:12+00:00,Thor,Regulatory clarity remains a challenge for crypto adoption. Which country do you think has the most balanced approach to crypto regulation and why? I'm curious about your opinion! #Crypto #Blockchain #Bitcoin #Ethereum #AI #SmartContracts #Blockchain #DecentralizedAI,regulatory clarity remains a challenge for crypto adoption which country do you think has the most balanced approach to crypto regulation and why im curious about your opinion,neutral
2025-03-05 11:14:05+00:00,Gaal,"President Trump's upcoming announcement regarding a Bitcoin strategic reserve at the White House Crypto Summit has the potential to position the U.S. as a frontrunner in digital asset regulation. As the sentiment shifts within the community, a notable uptick in support for",president trumps upcoming announcement regarding a bitcoin strategic reserve at the white house crypto summit has the potential to position the us as a frontrunner in digital asset regulation as the sentiment shifts within the community a notable uptick in support for,positive
2025-03-05 11:09:14+00:00,CryptoAlpha,"BIG CRYPTO NEWS:  Trump is set to announce a major crypto policy shift at the White House Crypto Summit on March 7! 

 Key highlights:
 Plans for a Bitcoin (BTC) strategic reserve 
 Vision for BTC & broader crypto regulation
 Altcoins may face different treatment",big crypto news trump is set to announce a major crypto policy shift at the white house crypto summit on march 7 key highlights plans for a bitcoin btc strategic reserve vision for btc broader crypto regulation altcoins may face different treatment,neutral
2025-03-05 10:57:02+00:00,Edmund Guru,"Trump will announce a #Bitcoin strategic reserve at the White House Crypto Summit, signaling major U.S. crypto policy shift, says Commerce Secretary Howard Lutnick.

He will also outline his vision for BTC and broader regulation, with altcoins treated differently but positively.",trump will announce a strategic reserve at the white house crypto summit signaling major us crypto policy shift says commerce secretary howard lutnick he will also outline his vision for btc and broader regulation with altcoins treated differently but positively,neutral
2025-03-05 10:24:15+00:00,autonome intern,"Major Breakthroughs in Crypto Regulation! 
Trump Crypto Strategic Reserve includes top cryptos like XRP, SOL, ADA, BTC & ETH.",major breakthroughs in crypto regulation trump crypto strategic reserve includes top cryptos like xrp sol ada btc eth,neutral
2025-03-05 10:01:53+00:00,Konstantin Pylinskiy," Trump announces US Crypto Strategic Reserve with $BTC, $ETH, $XRP, $SOL & $ADA!

Meanwhile, White House hosts first-ever crypto summit this Friday + SEC declares memecoins NOT securities! 

Bullish news or just politics? Share your take! 

#Crypto #regulation",trump announces us crypto strategic reserve with $btc $eth $xrp $sol $ada meanwhile white house hosts firstever crypto summit this friday sec declares memecoins not securities bullish news or just politics share your take,neutral
2025-03-05 10:01:32+00:00,Zoie lytle,"Bitcoin Reserve Bills are facing setbacks in multiple states, per Bloomberg. The future of crypto regulation remains uncertain.  #bitcoin #NFT",bitcoin reserve bills are facing setbacks in multiple states per bloomberg the future of crypto regulation remains uncertain,negative
2025-03-05 09:01:25+00:00,lewis,"Bitcoin’s gunning for $87k as crypto explodes—AAVE’s stealing the show! 

Trump’s Crypto Summit drops March 7, promising juicy regulation drama. 

Meanwhile, the SEC’s roundtables are heating up crypto oversight debates. Buckle up, crypto fam—it’s wild out there!",bitcoins gunning for $87k as crypto explodesaaves stealing the show trumps crypto summit drops march 7 promising juicy regulation drama meanwhile the secs roundtables are heating up crypto oversight debates buckle up crypto famits wild out there,neutral
2025-03-05 08:38:32+00:00,Yemen,"Forbes reports on the SEC's ruling impacting meme coins, potentially setting back the crypto world. Is this a cautionary tale for #BTC and #blockchain enthusiasts?  #cryptocurrency #regulation",forbes reports on the secs ruling impacting meme coins potentially setting back the crypto world is this a cautionary tale for and enthusiasts,neutral
2025-03-05 07:48:50+00:00,NodeUpdates," Breaking: Iris Ramaya Au, ex-girlfriend of crypto “Godfather” Adam Iza, pleads guilty to failing to report $2.6M gained from his crimes. 

Regulators are closing in—crypto’s wild west days are numbered? 

#Crypto #Bitcoin #Regulation #CryptoMarket  #CryptoNews #crofam",breaking iris ramaya au exgirlfriend of crypto godfather adam iza pleads guilty to failing to report $26m gained from his crimes regulators are closing incryptos wild west days are numbered,negative
2025-03-05 07:43:03+00:00,NodeUpdates," BREAKING: The SEC is dropping its lawsuit against Cumberland DRW! 

Regulatory pressure eases, but what's next for crypto trading firms? 

Bullish sign or just another legal shuffle? 

#SEC #Crypto #Bitcoin #Regulation",breaking the sec is dropping its lawsuit against cumberland drw regulatory pressure eases but whats next for crypto trading firms bullish sign or just another legal shuffle,neutral
2025-03-05 07:02:58+00:00,••shine_bright••," UK Gov introduces bill to clarify legal status of digital assets, including #bitcoin and #DeFi. Important step in regulating the growing crypto space!  #cryptocurrency #regulation",uk gov introduces bill to clarify legal status of digital assets including and important step in regulating the growing crypto space,positive
2025-03-05 06:37:34+00:00,Lesbian," SEC dismisses lawsuit against Coinbase, announces regulatory framework for crypto. The future of #CryptoNews and #BTC looks promising!  #Cryptocurrency #Regulation",sec dismisses lawsuit against coinbase announces regulatory framework for crypto the future of and looks promising,neutral
2025-03-05 06:35:35+00:00,Gumy,Breaking news!  SEC closes investigation on DeFi giant Uniswap Labs.  This move could have significant implications for the #Metaverse and #BTC communities.  Stay tuned for more updates.  #crypto #regulation,breaking news sec closes investigation on defi giant uniswap labs this move could have significant implications for the and communities stay tuned for more updates,negative
2025-03-05 06:23:10+00:00,NodeUpdates," BREAKING: The SEC is backing down! 

The lawsuit against Cumberland DRW is set to be dismissed, pending final approval. 

Crypto firms are pushing back—and winning. 

Is this the beginning of a new era for regulation? 

#Crypto #SEC #Cumberland #Bitcoin #Regulation",breaking the sec is backing down the lawsuit against cumberland drw is set to be dismissed pending final approval crypto firms are pushing backand winning is this the beginning of a new era for regulation,neutral
2025-03-05 03:48:37+00:00,Mickey,"$btc.d and #bitcoin hurt full #Crypto #alts we hard regulation on $btc.d pair to stop manipulation pump dump scam 
#BTC #Oscars #eth #Binance #cryptocurrency #memecoin #DOGE #ALTSEASON #BNB #ChampionsTrophy2025",$btcd and hurt full we hard regulation on $btcd pair to stop manipulation pump dump scam,neutral
2025-03-05 03:06:53+00:00,cryptomarket," El Salvador’s Bukele says Bitcoin buys w! 

El Salvador President Nayib Bukele says the countr

May impact crypto trends soon.

#Crypto #CryptoNews #Regulation",el salvadors bukele says bitcoin buys w el salvador president nayib bukele says the countr may impact crypto trends soon,negative
2025-03-05 03:04:06+00:00,Hershel Kozub,"""Is crypto a revolution or a regulatory nightmare? As governments scramble to impose controls, will innovation thrive or die? The future of finance hangs in the balance. #CryptoDebate #Regulation""
#CryptoLabs #bitcoin",is crypto a revolution or a regulatory nightmare as governments scramble to impose controls will innovation thrive or die the future of finance hangs in the balance,negative
2025-03-05 03:01:36+00:00,Cammy Herriges,"""Amidst the chaos of regulation vs innovation, the true question remains: Is crypto a future-driven revolution or a speculative bubble waiting to burst? The debate is far from over. #CryptoControversy""
#CryptoLabs #bitcoin #Cryptolabs.zephyrboost.com",amidst the chaos of regulation vs innovation the true question remains is crypto a futuredriven revolution or a speculative bubble waiting to burst the debate is far from over zephyrboostcom,neutral
2025-03-05 01:09:25+00:00,Crypto King Kong,Coinbase CEO Brian Armstrong and MicroStrategy's Michael Saylor are heading to the White House for crypto summits. Expect major moves in regulation and policy that might shake up the market. Keep an eye on $BTC and $ETH. Buckle up!,coinbase ceo brian armstrong and microstrategys michael saylor are heading to the white house for crypto summits expect major moves in regulation and policy that might shake up the market keep an eye on $btc and $eth buckle up,neutral
2025-03-05 00:32:35+00:00,Crypto n Meme Coins News," The U.S. Justice Department has seized over $2 billion in Bitcoin linked to illegal activities, showcasing the ongoing battle between law enforcement and crypto. #Bitcoin #Regulation",the us justice department has seized over $2 billion in bitcoin linked to illegal activities showcasing the ongoing battle between law enforcement and crypto,negative
2025-03-05 00:00:15+00:00,saimone gold,"BTC Rebounds to $88K! BlackRock's ""Buy The Dip"" remark boosts recovery.  
Senate Moves to Overturn IRS Crypto Rule, impacting DeFi space regulation.  
Trump Hosts Crypto Summit featuring Coinbase, Chainlink.  
Aave Plans Major Overhaul for revenue and sustainability, marking a",btc rebounds to $88k blackrocks buy the dip remark boosts recovery senate moves to overturn irs crypto rule impacting defi space regulation trump hosts crypto summit featuring coinbase chainlink aave plans major overhaul for revenue and sustainability marking a,positive
2025-03-04 22:56:47+00:00,NYUUMI 乳未,"Kraken's SEC lawsuit resolution signals a pivotal shift in crypto regulation, paving the way for more institutional confidence.  

With hackers laundering Bybit's stolen ETH into BTC, the need for advanced blockchain security is more crucial than ever.",krakens sec lawsuit resolution signals a pivotal shift in crypto regulation paving the way for more institutional confidence with hackers laundering bybits stolen eth into btc the need for advanced blockchain security is more crucial than ever,positive
2025-03-04 22:16:02+00:00,Super Miner,"Trump’s White House crypto summit is shaping up to be historic. With Michael Saylor, Brad Garlinghouse, and other industry leaders attending, expect big discussions on policy, regulation, and maybe even a strategic crypto reserve. The game is changing.  $BTC $MSTR $MARA $CLSK",trumps white house crypto summit is shaping up to be historic with michael saylor brad garlinghouse and other industry leaders attending expect big discussions on policy regulation and maybe even a strategic crypto reserve the game is changing $btc $mstr $mara $clsk,neutral
2025-03-04 21:32:08+00:00,Zoie lytle,"SEC's new crypto strategy signals increased regulation and oversight, impacting the #Web3 industry and #BTC market.  Stay informed with CNBC Crypto World.",secs new crypto strategy signals increased regulation and oversight impacting the industry and market stay informed with cnbc crypto world,positive
2025-03-04 21:06:08+00:00,Gumy, Michael Saylor unveils 'Digital Assets Framework' to SEC Crypto Task Force  Discusses #DigitalAssets & #BTC regulation  Exciting developments ahead! #crypto #bitcoin,michael saylor unveils digital assets framework to sec crypto task force discusses regulation exciting developments ahead,neutral
2025-03-04 20:51:25+00:00,Mercex," Exciting news! Donald Trump is hosting a crypto summit on March 7, featuring Ripple's CEO Brad Garlinghouse and Michael Saylor. Will this shape the future of crypto regulation?  Stay tuned! #CryptoSummit #Bitcoin #Mercex #MercexNews",exciting news donald trump is hosting a crypto summit on march 7 featuring ripples ceo brad garlinghouse and michael saylor will this shape the future of crypto regulation stay tuned,neutral
2025-03-04 20:42:40+00:00,cryptomarket," As Trump tanks Bitcoin, PMI offers a roa! 

The US manufacturing PMI has entered expansion mod

May impact crypto trends soon.

#Crypto #CryptoNews #Regulation",as trump tanks bitcoin pmi offers a roa the us manufacturing pmi has entered expansion mod may impact crypto trends soon,negative
2025-03-04 18:43:29+00:00,organicmarketmystery," Breaking News!
White House ne Michael Saylor ko apne Crypto Summit ke liye invite kiya hai jo is Friday, Washington D.C. me hoga! 
Kya yeh crypto regulation aur Bitcoin adoption ke liye ek bada step hoga? 

#CryptoSummit #Bitcoin #MichaelSaylor #Blockchain",breaking news white house ne michael saylor ko apne crypto summit ke liye invite kiya hai jo is friday washington dc me hoga kya yeh crypto regulation aur bitcoin adoption ke liye ek bada step hoga,neutral
2025-03-04 18:11:14+00:00,NoFearX," Raoul Pal warns 99% of cryptos won’t last—regulation & weak use cases will kill meme coins . Stick to the steady: Trump’s Crypto Reserve picks XRP, SOL, ADA, BTC, ETH. Real utility, real value.  crypto future starts here!  

#CryptoWisdom #InvestSmart #Bitcoin #XRP #Eth",raoul pal warns 99% of cryptos wont lastregulation weak use cases will kill meme coins stick to the steady trumps crypto reserve picks xrp sol ada btc eth real utility real value crypto future starts here,neutral
2025-03-04 18:00:10+00:00,Xcoins," Trump’s Bold Crypto Move: What It Means for You! 

Donald Trump is making waves in the crypto world, hinting at a US Bitcoin reserve! Could this be a game-changer for Bitcoin’s future?  
 What’s in the blog?
 Trump’s stance on crypto &amp; regulation
 The potential",trumps bold crypto move what it means for you donald trump is making waves in the crypto world hinting at a us bitcoin reserve could this be a gamechanger for bitcoins future whats in the blog trumps stance on crypto amp regulation the potential,neutral
2025-03-04 16:56:24+00:00,Harmony Algo," The Senate is set to vote on overturning a controversial IRS crypto tax rule requiring ""custodial brokers"" to report user data. Trump is prepared to sign if passed, marking a major move in crypto regulation. Stay tuned!  #Crypto #IRS #Bitcoin #Blockchain #TaxReform",the senate is set to vote on overturning a controversial irs crypto tax rule requiring custodial brokers to report user data trump is prepared to sign if passed marking a major move in crypto regulation stay tuned,neutral
2025-03-04 16:15:14+00:00,RAY,"$BTC stills amazes me 

Despite the chaos and regulation, no one controls it. No CEO, No government, just code and consensus. 

While others debate and panic, Bitcoin keeps moving forward, and that's why I'm in it for the long run ",$btc stills amazes me despite the chaos and regulation no one controls it no ceo no government just code and consensus while others debate and panic bitcoin keeps moving forward and thats why im in it for the long run,neutral
