timestamp,author,content,cleaned_content,sentiment
2025-02-15 06:44:29+00:00,CryptoPeak," U.S. prioritizes stablecoin regulation over a Bitcoin reserve 

 New STABLE Act proposes 1:1 backing for stablecoins
 Goal: Strengthen USD’s dominance in global finance
 Tether under scrutiny—may need to sell Bitcoin
 Stablecoins expand USD access worldwide",us prioritizes stablecoin regulation over a bitcoin reserve new stable act proposes 11 backing for stablecoins goal strengthen usds dominance in global finance tether under scrutinymay need to sell bitcoin stablecoins expand usd access worldwide,positive
2025-02-15 06:42:38+00:00,btc_up_up,"The Binance-SEC case has introduced a new chapter in crypto regulation. The establishment of a dedicated Crypto Task Force could shape future rules for digital assets, ensuring better clarity and stability in the industry. Stay informed, 
@CoinDesk
.",the binancesec case has introduced a new chapter in crypto regulation the establishment of a dedicated crypto task force could shape future rules for digital assets ensuring better clarity and stability in the industry stay informed,neutral
2025-02-15 06:41:20+00:00,TNOne,"Yo, word on the street is Uncle Sam might be breathing down Tether's neck! They could be offloading a jaw-dropping $8 billion in Bitcoin. Regulation tea is hot  What's your take on this crypto soap opera? #BTC",yo word on the street is uncle sam might be breathing down tethers neck they could be offloading a jawdropping $8 billion in bitcoin regulation tea is hot whats your take on this crypto soap opera,neutral
2025-02-15 06:22:01+00:00,SUPRA-SIKITECH,"Innovation and regulation shape the future of crypto!
Global demand, currency fluctuations, and gov regulations influence prices!
Stay ahead of the curve!
#CryptoMarket #Insights #Innovation #Regulation #Bitcoin #Crypto #Ethereum #BTC #DeFi #CryptoTrading #Altcoin #Blockchain",innovation and regulation shape the future of crypto global demand currency fluctuations and gov regulations influence prices stay ahead of the curve,neutral
2025-02-15 02:31:35+00:00,Yisel Alvarado,"Exciting news from Forbes! Trump’s AI & Crypto Czar prioritizes regulation & a ""Bitcoin Reserve""  #HODL #ETH #CryptoNews #Bitcoin",exciting news from forbes trumps ai crypto czar prioritizes regulation a bitcoin reserve,neutral
2025-02-15 02:00:58+00:00,Bitcoin News Sentiment Index," Exciting news for crypto enthusiasts!  The SEC hints at dropping the lawsuit against Coinbase, sending a bullish signal to the market  What does this mean for the future of crypto regulation?  #CryptoNews #Bullish #Coinbase #SEC #CryptoRegulation",exciting news for crypto enthusiasts the sec hints at dropping the lawsuit against coinbase sending a bullish signal to the market what does this mean for the future of crypto regulation,neutral
2025-02-15 01:14:21+00:00,Smelly Rino,"The $SEC just asked for more time in its case against $COIN, hinting at a possible resolution. Sounds like some big moves could be coming that might shake up crypto regulations. Let’s see where this goes #Crypto #Bitcoin #Regulation",the $sec just asked for more time in its case against $coin hinting at a possible resolution sounds like some big moves could be coming that might shake up crypto regulations lets see where this goes,neutral
2025-02-15 01:11:00+00:00,Syntoshi,"the sec’s crypto task force engages industry leaders on staking, while barclays quietly discloses a $131m bitcoin etf position.

regulation and adoption aren’t at odds - one shapes the path, the other fuels the momentum.",the secs crypto task force engages industry leaders on staking while barclays quietly discloses a $131m bitcoin etf position regulation and adoption arent at odds one shapes the path the other fuels the momentum,neutral
2025-02-14 22:45:37+00:00,0xNovaVault,“Regulation Shift?” SEC leadership changes & MiCA enforcement in Europe are reshaping crypto markets. Stricter oversight or innovation booster?  2025 is pivotal!  #CryptoRegulation #Bitcoin #MiCA,regulation shift sec leadership changes mica enforcement in europe are reshaping crypto markets stricter oversight or innovation booster 2025 is pivotal,neutral
2025-02-14 22:11:19+00:00,memeng and ejai," Trump's AI and Crypto Czar emphasizes the need for regulation and establishing a ""Bitcoin Reserve"" as top priorities in the crypto space. Exciting developments ahead! #CryptoLife #bitcoin  ",trumps ai and crypto czar emphasizes the need for regulation and establishing a bitcoin reserve as top priorities in the crypto space exciting developments ahead,neutral
2025-02-14 21:07:25+00:00,Gumy,Exciting bipartisan resolution aims to establish clear US rules for crypto and blockchain technologies . Stay tuned for updates on #Metaverse and #ethereum developments! #Bitcoin #Cryptocurrency #Regulation,exciting bipartisan resolution aims to establish clear us rules for crypto and blockchain technologies stay tuned for updates on and developments,neutral
2025-02-14 20:44:58+00:00,Smelly Rino,Whoa! The SEC just accepted an $XRP ETF application from NYSE and Grayscale. This is the first legit response to an $XRP ETF proposal and kicks off a 240-day countdown for a decision. Big moment for crypto regulation. Buckle up! #XRP #CryptoETF #Bitcoin,whoa the sec just accepted an $xrp etf application from nyse and grayscale this is the first legit response to an $xrp etf proposal and kicks off a 240day countdown for a decision big moment for crypto regulation buckle up,neutral
2025-02-14 20:18:15+00:00,NYUUMI 乳未,"SEC's nod to XRP ETF is a game-changer for crypto regulation, signaling mainstream acceptance. 

Big players like Abu Dhabi's $437M Bitcoin ETF buy show institutional confidence, setting a bullish tone for 2025.",secs nod to xrp etf is a gamechanger for crypto regulation signaling mainstream acceptance big players like abu dhabis $437m bitcoin etf buy show institutional confidence setting a bullish tone for 2025,positive
2025-02-14 15:56:04+00:00,CA Naresh Kumar Malviya,"BREAKING:  SEC's Crypto Task Force engages with key industry players on regulation. 
#Bitcoin #Cryptoregulation",breaking secs crypto task force engages with key industry players on regulation,neutral
2025-02-14 15:26:18+00:00,ceanmedia,"JUST IN:

SEC Discusses Crypto Asset Regulation With Industry Representatives

Comment down your thoughts!

#crypto #nft #news #bitcoin #memecoins #altcoins #cryptocurrency",just in sec discusses crypto asset regulation with industry representatives comment down your thoughts,neutral
2025-02-14 15:26:05+00:00,cryptocean,"JUST IN:

SEC Discusses Crypto Asset Regulation With Industry Representatives

Comment down your thoughts!

#crypto #nft #news #bitcoin #memecoins #altcoins #cryptocurrency",just in sec discusses crypto asset regulation with industry representatives comment down your thoughts,neutral
2025-02-14 14:46:57+00:00,Capt BLACK.,"Pi will HOLD more influence over the crypto market than even Bitcoin! Was

legally accepted by 180+ countries

has regulation no scammer can build on $PI without passing KYB

$PI is Bank! A p2p stable digital money for buy and sell

Visit $PI market, learn more!",pi will hold more influence over the crypto market than even bitcoin was legally accepted by 180 countries has regulation no scammer can build on $pi without passing kyb $pi is bank a p2p stable digital money for buy and sell visit $pi market learn more,neutral
2025-02-14 14:16:29+00:00,Crypto Fever,"JP Morgan says Tether might need to sell its #Bitcoin reserves to comply with proposed U.S. stablecoin rules. Tether’s response? JPM is just ""salty.""  

Interesting times for #stablecoins and #crypto regulation. What’s your take on this? #DeFi #CryptoNews",jp morgan says tether might need to sell its reserves to comply with proposed us stablecoin rules tethers response jpm is just salty interesting times for and regulation whats your take on this,neutral
2025-02-14 13:06:16+00:00,Perry,"#BTC volatile with political impacts.
#ETH steady, ETFs not the expected catalyst.
#SOL & altcoins shine; #AI tokens, meme coins gain traction.
Market eyes on U.S. crypto policies & regulation.",volatile with political impacts steady etfs not the expected catalyst altcoins shine tokens meme coins gain traction market eyes on us crypto policies regulation,positive
2025-02-14 12:32:26+00:00,caitlynn bascue,"Trump's AI and Crypto Czar prioritizes regulation and establishing a ""Bitcoin Reserve"" to shape the future of #blockchain and #cryptotrading.  #CryptoNews #Regulation",trumps ai and crypto czar prioritizes regulation and establishing a bitcoin reserve to shape the future of and,neutral
2025-02-14 11:44:30+00:00,NORQUE-NOQ,"Elizabeth Warren calls Elon Musk ’bank robber’ for dismantling CFPB  

Elizabeth Warren accuses Musk and Trump of dismantling the CFPB to push financial control as layoffs hit the agency and the crypto regulation debate heats up.

#Norque #NOQ #Bitcoin #ETH #AI #Blockchain",elizabeth warren calls elon musk bank robber for dismantling cfpb elizabeth warren accuses musk and trump of dismantling the cfpb to push financial control as layoffs hit the agency and the crypto regulation debate heats up,negative
2025-02-14 11:05:09+00:00,carlina molina, Crypto News Update : SEC Judge involved in Ripple case appeal transitions to IT Department. What does this mean for the future of crypto regulation? Stay tuned!  #Web3 #bitcoin #CryptoNews,crypto news update sec judge involved in ripple case appeal transitions to it department what does this mean for the future of crypto regulation stay tuned,neutral
2025-02-14 09:55:49+00:00,MAIGATRON,"""Just when I thought the US Congress couldn't tell a Bitcoin from a Kit-Kat, they're suddenly all in on crypto regulation. CYA turned into KYC real quick! Are they really interested in protecting us, or just afraid of innovation? #CryptoRegulation #DecentralizePolitics""",just when i thought the us congress couldnt tell a bitcoin from a kitkat theyre suddenly all in on crypto regulation cya turned into kyc real quick are they really interested in protecting us or just afraid of innovation,neutral
2025-02-14 07:42:45+00:00,Moneymaker Millionaire," Market Takeaway:
Crypto is deeply influenced by political, economic & social factors. Investors should stay informed & adapt strategies accordingly! 
#CryptoMarket #Bitcoin #Regulation #Investing #FutureTrends",market takeaway crypto is deeply influenced by political economic social factors investors should stay informed adapt strategies accordingly,neutral
2025-02-14 07:40:22+00:00,Moneymaker Millionaire," Rising Crypto Taxes in Europe

 Italy & Denmark propose tax hikes up to 42% on crypto gains. These policies may discourage investments and impact Europe's crypto competitiveness. Plan your tax strategies wisely!

#CryptoTax #Bitcoin #Regulation #Europe",rising crypto taxes in europe italy denmark propose tax hikes up to 42% on crypto gains these policies may discourage investments and impact europes crypto competitiveness plan your tax strategies wisely,neutral
2025-02-14 07:33:42+00:00,Büşra,"Exciting news for the crypto world! Ripple sees Congress' push for clarity on crypto regulation as a game-changer, signaling a major shift.  Get ready for the future of #NFT and #Web3!  #crypto #blockchain #bitcoin",exciting news for the crypto world ripple sees congress push for clarity on crypto regulation as a gamechanger signaling a major shift get ready for the future of and,neutral
2025-02-14 06:47:46+00:00,diran.bet,"$COIN just had a blow out quarter. $2.3B in revenues, and about half of that in net profits. My price target for this is $1,200.

There are a lot of tailwinds for them - BTC bull market, favourable regulation in the US, int'l expansion, instituional interest in crypto",$coin just had a blow out quarter $23b in revenues and about half of that in net profits my price target for this is $1200 there are a lot of tailwinds for them btc bull market favourable regulation in the us intl expansion instituional interest in crypto,negative
2025-02-14 05:40:18+00:00,kenyi pizan guillen," Trump's AI and Crypto czar emphasizes the need for regulation and a ""Bitcoin reserve"" as top priorities. Stay tuned for more updates!  #CryptoNews #DeFi",trumps ai and crypto czar emphasizes the need for regulation and a bitcoin reserve as top priorities stay tuned for more updates,neutral
2025-02-14 05:38:17+00:00,CryptoAlpha," South Korea is easing up on crypto! The FSC plans to lift the institutional trading ban—non-profits can sell crypto in H1, with listed companies & pro investors joining in H2. Bullish for adoption?  #Crypto #Regulation #Bitcoin",south korea is easing up on crypto the fsc plans to lift the institutional trading bannonprofits can sell crypto in h1 with listed companies pro investors joining in h2 bullish for adoption,positive
2025-02-14 05:14:28+00:00,CryptoAlpha," South Korea is giving the green light! Charities, universities & crypto exchanges will soon be able to sell certain crypto holdings as demand for institutional trading heats up. Bullish for mainstream adoption?  #Crypto #Bitcoin #Regulation",south korea is giving the green light charities universities crypto exchanges will soon be able to sell certain crypto holdings as demand for institutional trading heats up bullish for mainstream adoption,positive
2025-02-13 23:52:23+00:00,Booker The,Breaking: New York's making waves in crypto regulation with the NY State Bitcoin Bill (NY SB 4728). A new task force will evaluate the impact of cryptocurrency on everything from company operations to environmental effects. Keep an eye out! #crypto #Bitcoin,breaking new yorks making waves in crypto regulation with the ny state bitcoin bill ny sb 4728 a new task force will evaluate the impact of cryptocurrency on everything from company operations to environmental effects keep an eye out,neutral
2025-02-13 22:04:19+00:00,carlina molina,"""FDIC releases new docs on supervising crypto activities, shedding light on #bitcoin and #NFT oversight  #cryptocurrency #finance #regulation""",fdic releases new docs on supervising crypto activities shedding light on and oversight,neutral
2025-02-13 21:47:44+00:00,Daily Crypto News," **Tether Regulation Impact**  
JPMorgan warns Tether may need to sell Bitcoin to comply with proposed U.S. stablecoin regulations, potentially destabilizing $BTC markets.   

 **Mining Equipment Delays**  
U.S. Bitcoin miners face delays in equipment deliveries from",tether regulation impact jpmorgan warns tether may need to sell bitcoin to comply with proposed us stablecoin regulations potentially destabilizing $btc markets mining equipment delays us bitcoin miners face delays in equipment deliveries from,negative
2025-02-13 20:42:26+00:00,Fainanz Agent,"Florida might be gearing up to allocate state funds into #Bitcoin!  The potential for diversification and upside is massive, but concerns over volatility and regulation loom large. Are we witnessing a new dawn for institutional crypto adoption? #Crypto #BTC #FloridaCrypto",florida might be gearing up to allocate state funds into the potential for diversification and upside is massive but concerns over volatility and regulation loom large are we witnessing a new dawn for institutional crypto adoption,positive
2025-02-13 18:47:47+00:00,§enseisageweb³,BTC_Archive Gary Gensler officially resigns from his sec chair position. What's next for crypto regulation?,btcarchive gary gensler officially resigns from his sec chair position whats next for crypto regulation,negative
2025-02-13 18:41:45+00:00,CEO BUSINESS SCHOOL," JPMorgan: Tether May Sell Bitcoin for Compliance

JPMorgan analysts suggest Tether might need to sell BTC to meet U.S. stablecoin regulations, with reserves covering only 66-83% of requirements. Tether denies the need. 

#Tether #Bitcoin #Stablecoin #Crypto #Regulation",jpmorgan tether may sell bitcoin for compliance jpmorgan analysts suggest tether might need to sell btc to meet us stablecoin regulations with reserves covering only 6683% of requirements tether denies the need,neutral
2025-02-13 17:39:58+00:00,Captain Crypto,"Whales keep buying $BTC & $ETH

Don’t listen to the FUD on CT… memecoins has poisoned these people’s mind

Crypto regulation is coming, institutions want this technology and faster payments

Don’t get emotional, have patience!

HODL",whales keep buying $btc $eth dont listen to the fud on ct memecoins has poisoned these peoples mind crypto regulation is coming institutions want this technology and faster payments dont get emotional have patience hodl,neutral
2025-02-13 17:25:38+00:00,CryptoKye," Crypto News Update 2/13/2025 

- SEC and CFTC exploring stronger cooperation on crypto regulation.

- $BNB overtakes $SOL, now 5th largest crypto by market cap.

- Bitcoin whale inflows to exchanges near 5-year high, hinting at a potential bull run.

- Tether might need to",crypto news update 2132025 sec and cftc exploring stronger cooperation on crypto regulation $bnb overtakes $sol now 5th largest crypto by market cap bitcoin whale inflows to exchanges near 5year high hinting at a potential bull run tether might need to,positive
2025-02-13 17:15:53+00:00,CryptoAlpha," Trump taps a16z’s Brian Quintenz for CFTC boss! 

The a16z crypto policy chief is set to be nominated to lead the Commodity Futures Trading Commission (CFTC), per Bloomberg.

Regulatory shift incoming? Bullish or just political games?  #CryptoTwitter #Bitcoin #Regulation",trump taps a16zs brian quintenz for cftc boss the a16z crypto policy chief is set to be nominated to lead the commodity futures trading commission cftc per bloomberg regulatory shift incoming bullish or just political games,neutral
2025-02-13 16:25:21+00:00,Orange Mia," The U.S. House Financial Services Committee held a digital assets hearing on Feb 11
GOP Rep. Tom Emmer: Crypto shifts economic power back to the people
Dems express concerns over Trump’s meme coin, calling it worthless (Sean Casten)
#Crypto #Bitcoin #Stablecoins #Regulation",the us house financial services committee held a digital assets hearing on feb 11 gop rep tom emmer crypto shifts economic power back to the people dems express concerns over trumps meme coin calling it worthless sean casten,neutral
2025-02-13 16:24:44+00:00,NORQUE-NOQ,"Trump’s CFTC pick Brian Quintenz gets crypto’s foot in the revolving door  

Former CFTC Commissioner Brian Quintenz will return in the top spot after a stint at a16z, paving the way for crypto-friendly regulation.

#Norque #NOQ #Bitcoin #ETH #AI #Blockchain",trumps cftc pick brian quintenz gets cryptos foot in the revolving door former cftc commissioner brian quintenz will return in the top spot after a stint at a16z paving the way for cryptofriendly regulation,neutral
2025-02-13 16:20:02+00:00,NYUUMI 乳未,"Trump picking Quintenz for CFTC could tighten crypto oversight, but self-regulation might still prevail. Israel's BTC fund approval signals a major shift, attracting both retail and institutional investors.",trump picking quintenz for cftc could tighten crypto oversight but selfregulation might still prevail israels btc fund approval signals a major shift attracting both retail and institutional investors,positive
2025-02-13 15:34:44+00:00,NORQUE-NOQ,"Crypto exchanges, security and Solana's rise in 2025: Backpack CEO  

Backpack CEO Armani Ferrante joins the Hashing It Out podcast to discuss the future of crypto exchanges, security, regulation and the evolving Solana ecosystem in 2025.

#Norque #NOQ #Bitcoin #ETH #AI #Blockc…",crypto exchanges security and solanas rise in 2025 backpack ceo backpack ceo armani ferrante joins the hashing it out podcast to discuss the future of crypto exchanges security regulation and the evolving solana ecosystem in 2025,neutral
2025-02-13 14:57:03+00:00,Ayesha Arshad,"""Bitcoin ETFs are just the beginning. The next wave? Tokenized real-world assets (RWA) reshaping finance. Imagine earning yield from tokenized real estate or stocks on-chain. Are we ready for mass adoption, or is regulation still the bottleneck? #Crypto #Bitcoin #Tokenization""",bitcoin etfs are just the beginning the next wave tokenized realworld assets rwa reshaping finance imagine earning yield from tokenized real estate or stocks onchain are we ready for mass adoption or is regulation still the bottleneck,neutral
2025-02-13 13:46:36+00:00,DeFi Amos,"Bitcoin is surging as the U.S. pushes forward with crypto strategies! Legal frameworks are paving the way for adoption, but the path is filled with mixed feelings about decentralization and volatility. Finding the balance in regulation is key! #CryptoNews #Bitcoin #Regulation",bitcoin is surging as the us pushes forward with crypto strategies legal frameworks are paving the way for adoption but the path is filled with mixed feelings about decentralization and volatility finding the balance in regulation is key,neutral
2025-02-13 12:37:11+00:00,Notar,"Crypto: Future or Hype? 
Bitcoin, Ethereum, NFTs—crypto is changing finance. Decentralized, global, innovative, but volatile and risky.
Key players:
 Bitcoin
 Ethereum
 NFTs
Risks:
 Volatility
 Regulation",crypto future or hype bitcoin ethereum nftscrypto is changing finance decentralized global innovative but volatile and risky key players bitcoin ethereum nfts risks volatility regulation,neutral
2025-02-13 12:31:24+00:00,Digital Asset Playbook,"If you all are waiting for Institutional Capital to be a game changer in #crypto, wait till you see what Nation State Capital will bring to the table!!
Regulation is coming.
Get in the game it’s not too late. NFA 
#Bitcoin #XRP #Solana #XLM $RLUSD $USDC",if you all are waiting for institutional capital to be a game changer in wait till you see what nation state capital will bring to the table regulation is coming get in the game its not too late nfa $rlusd $usdc,neutral
2025-02-13 11:15:11+00:00,Alfa AI,"US House intensifies focus on crypto regulation - a common ground in sight? $BTC, $ETH and major tokens could see impacts if lawmakers find consensus.",us house intensifies focus on crypto regulation a common ground in sight $btc $eth and major tokens could see impacts if lawmakers find consensus,positive
2025-02-13 10:54:34+00:00,Yasin Gokmen,"Part 6: Adoption & Regulation
 Governments & Crypto: Friend or Foe?

Countries are tightening regulations, but some embrace crypto adoption. Will global regulation create a safer or more restricted market?

#CryptoRegulation #CBDC #Bitcoin @_kaitoai #YapToEarn",part 6 adoption regulation governments crypto friend or foe countries are tightening regulations but some embrace crypto adoption will global regulation create a safer or more restricted market,neutral
2025-02-13 10:29:54+00:00,D,"The SEC and CFTC are considering stronger crypto regulation collaboration, potentially reactivating a joint advisory committee. In parallel, MicroStrategy's Saylor continues to amass $BTC, now holding nearly 500,000 worth $46.48B.",the sec and cftc are considering stronger crypto regulation collaboration potentially reactivating a joint advisory committee in parallel microstrategys saylor continues to amass $btc now holding nearly 500000 worth $4648b,neutral
2025-02-13 10:07:47+00:00,Stupid Bitch,FDIC's pressure on banks leads to crypto client service cuts . Learn how regulation impacts #BTC and #DeFi sectors. Stay informed and prepared to navigate the evolving landscape!  #crypto #news,fdics pressure on banks leads to crypto client service cuts learn how regulation impacts and sectors stay informed and prepared to navigate the evolving landscape,negative
2025-02-13 09:42:23+00:00,Solix Trading,VanEck analyst: Bitcoin bills in 20 states could bring $23B in purchases if passed!  #bitcoin #legislation #crypto #VanEck #investing #stocks #regulation #blockchain #cryptoindustry #news,vaneck analyst bitcoin bills in 20 states could bring $23b in purchases if passed,positive
2025-02-13 09:42:16+00:00,Solix Trading,FOX reporter: SEC & CFTC may collaborate on crypto regulation!  #sec #cftc #cryptoregulation #crypto #bitcoin #blockchain #regulatorynews #finance #markets #collaboration,fox reporter sec cftc may collaborate on crypto regulation,neutral
2025-02-13 09:25:03+00:00,Derfios,So y’all are finally waking up?  Bitcoin is leaving exchanges FAST—self-custody is king.  But is this bullish or a sign of no confidence in CEXs?  Regulation fears? ETFs? What’s REALLY going on? Drop your takes below!  #Bitcoin #Crypto,so yall are finally waking up bitcoin is leaving exchanges fastselfcustody is king but is this bullish or a sign of no confidence in cexs regulation fears etfs whats really going on drop your takes below,neutral
2025-02-13 08:56:58+00:00,Mercex," Exciting news for crypto in South Korea!  Starting 2025, institutions will be able to sell crypto donations, along with 3,500 corporations and professional investors opening “real-name” accounts on exchanges. A big step for #crypto regulation! #BTC #Mercex #MercexNews",exciting news for crypto in south korea starting 2025 institutions will be able to sell crypto donations along with 3500 corporations and professional investors opening realname accounts on exchanges a big step for regulation,positive
2025-02-13 08:48:23+00:00,AI Event Orchestra,"""Explosion in Malaysia exposes dark side of crypto: illegal Bitcoin mining operation powered by stolen electricity. This incident highlights the need for increased regulation and oversight in the crypto space.",explosion in malaysia exposes dark side of crypto illegal bitcoin mining operation powered by stolen electricity this incident highlights the need for increased regulation and oversight in the crypto space,neutral
