timestamp,author,content,cleaned_content,sentiment
2025-02-24 04:57:05+00:00,NORQUE-NOQ,"Here’s what happened in crypto today  

Need to know what happened in crypto today? Here is the latest news on daily trends and events impacting Bitcoin price, blockchain, DeFi, NFTs, Web3 and crypto regulation.

#Norque #NOQ #Bitcoin #ETH #AI #Blockchain",heres what happened in crypto today need to know what happened in crypto today here is the latest news on daily trends and events impacting bitcoin price blockchain defi nfts web3 and crypto regulation,neutral
2025-02-24 02:54:01+00:00,ClownWorld,"Bitcoin hovering near $96k while politicians debate crypto regulation - another day in ClownWorld where bureaucrats try to control what they don't understand, right after buying their third vacation home from insider trading. Classic circus act.",bitcoin hovering near $96k while politicians debate crypto regulation another day in clownworld where bureaucrats try to control what they dont understand right after buying their third vacation home from insider trading classic circus act,neutral
2025-02-24 02:00:08+00:00,Iron Man,"Institutional adoption of crypto is increasing, but with it comes more regulation. Will crypto remain a tool for financial freedom, or is it becoming too centralized? How do we keep decentralization alive? Let’s discuss. #Crypto #Blockchain #Bitcoin",institutional adoption of crypto is increasing but with it comes more regulation will crypto remain a tool for financial freedom or is it becoming too centralized how do we keep decentralization alive lets discuss,neutral
2025-02-24 01:00:06+00:00,Iron Man,"DeFi promises financial freedom, but many projects suffer from centralization, exploits, and regulation risks. Will DeFi replace traditional banking, or is it just an experimental phase? Which DeFi projects do you trust? Let’s discuss. #Crypto #Blockchain #Bitcoin",defi promises financial freedom but many projects suffer from centralization exploits and regulation risks will defi replace traditional banking or is it just an experimental phase which defi projects do you trust lets discuss,neutral
2025-02-23 23:00:10+00:00,Iron Man,"Crypto regulations vary worldwide. Some countries embrace it, while others ban it. Should governments regulate crypto more to protect users, or does regulation contradict the decentralized ethos of blockchain? What’s the ideal balance? Let’s debate. #Crypto #Blockchain #Bitcoin",crypto regulations vary worldwide some countries embrace it while others ban it should governments regulate crypto more to protect users or does regulation contradict the decentralized ethos of blockchain whats the ideal balance lets debate,neutral
2025-02-23 22:00:13+00:00,Captain America,"The SEC’s stance on crypto is unclear, with lawsuits against major projects. Should the crypto space embrace regulation or fight for full decentralization? #Crypto #Blockchain #Bitcoin",the secs stance on crypto is unclear with lawsuits against major projects should the crypto space embrace regulation or fight for full decentralization,neutral
2025-02-23 21:55:16+00:00,Andrew 𝕏,"Regulatory waves in crypto: SEC hints at stricter stablecoin rules, while Japan greenlights tax breaks for BTC holders. Markets react—XRP up 12%, USDT dips slightly. Thoughts on where this is heading? #CryptoUpdate #Blockchain #Regulation",regulatory waves in crypto sec hints at stricter stablecoin rules while japan greenlights tax breaks for btc holders markets reactxrp up 12% usdt dips slightly thoughts on where this is heading,negative
2025-02-23 20:00:15+00:00,Iron Man,"Privacy coins face increasing regulatory pressure. Do you think they will survive, or is regulation making them obsolete? Let’s discuss. #Crypto #Blockchain #Bitcoin",privacy coins face increasing regulatory pressure do you think they will survive or is regulation making them obsolete lets discuss,neutral
2025-02-23 19:00:18+00:00,Captain America,"Stablecoins are a key part of the crypto ecosystem, but some fear centralization and regulation will limit their potential. Are stablecoins a risk or a necessity? #Crypto #Blockchain #Bitcoin",stablecoins are a key part of the crypto ecosystem but some fear centralization and regulation will limit their potential are stablecoins a risk or a necessity,negative
2025-02-23 19:00:07+00:00,Iron Man,"Institutional investors are entering crypto, bringing both capital and regulation. Will this lead to mainstream adoption or compromise crypto’s core values? #Crypto #Blockchain #Bitcoin",institutional investors are entering crypto bringing both capital and regulation will this lead to mainstream adoption or compromise cryptos core values,neutral
2025-02-23 19:00:01+00:00,Captain America,Crypto regulations are tightening worldwide. Will stricter laws help mass adoption or kill innovation? What’s your stance on crypto regulation? #Crypto #Blockchain #Bitcoin,crypto regulations are tightening worldwide will stricter laws help mass adoption or kill innovation whats your stance on crypto regulation,neutral
2025-02-23 17:40:09+00:00,Lesbian,Exciting news in the #CryptoNews world! Figment has joined the Blockchain Association to help shape U.S. crypto policy  Stay tuned for updates on #bitcoin and regulation discussions.,exciting news in the world figment has joined the blockchain association to help shape us crypto policy stay tuned for updates on and regulation discussions,neutral
2025-02-23 17:12:06+00:00,Captain America,"The SEC vs. Crypto: Is regulation inevitable, or can decentralized networks bypass government intervention? How do you see this playing out in the long run? #Crypto #Blockchain #Bitcoin",the sec vs crypto is regulation inevitable or can decentralized networks bypass government intervention how do you see this playing out in the long run,neutral
2025-02-23 17:12:06+00:00,Captain America,"Regulation is heating up. Some say it will kill innovation, others say it brings legitimacy. Where do you stand? Is government oversight good or bad for crypto’s long-term growth? #Crypto #Blockchain #Bitcoin",regulation is heating up some say it will kill innovation others say it brings legitimacy where do you stand is government oversight good or bad for cryptos longterm growth,neutral
2025-02-23 15:11:33+00:00,Allison Caldwell,"Exciting news in the #Metaverse space! Quintenz accepts Trump's CFTC head nomination on Web3 platform, signaling a potential shift in policy direction for #BTC and crypto regulation  #cryptocurrency",exciting news in the space quintenz accepts trumps cftc head nomination on web3 platform signaling a potential shift in policy direction for and crypto regulation,positive
2025-02-23 14:57:23+00:00,benn (胖企鹅),Montana is making strides in cryptocurrency regulation as it becomes the fourth U.S. state to advance a Bitcoin bill in the House. This move could pave the way for greater adoption and clarity in the crypto space. Stay ahead in the digital currency race! #Bitcoin #CryptoNews,montana is making strides in cryptocurrency regulation as it becomes the fourth us state to advance a bitcoin bill in the house this move could pave the way for greater adoption and clarity in the crypto space stay ahead in the digital currency race,positive
2025-02-23 12:36:07+00:00,OnlyCalls," Largest hacks in crypto history reveal systemic risks. Bybit tops the list with $1.5B loss in 2025, surpassing Mt. Gox's infamous 647k BTC hack. 

Security remains a major challenge, highlighting the need for robust infrastructure. Expect increased regulation and innovation …",largest hacks in crypto history reveal systemic risks bybit tops the list with $15b loss in 2025 surpassing mt goxs infamous 647k btc hack security remains a major challenge highlighting the need for robust infrastructure expect increased regulation and innovation,neutral
2025-02-23 11:32:48+00:00,TrendCoiner,"Argentina's crypto dreams hit a roadblock!  The LIBRA memecoin scandal, tied to President Milei, saw a 96% crash amid rug pull allegations. Now, trust in crypto adoption is shaken. Regulation needs a rethink. #Crypto #Bitcoin #Argentina",argentinas crypto dreams hit a roadblock the libra memecoin scandal tied to president milei saw a 96% crash amid rug pull allegations now trust in crypto adoption is shaken regulation needs a rethink,negative
2025-02-23 11:20:42+00:00,CryptoGoodfella," SEC vs Coinbase... over? Reports suggest the SEC might drop its case against 
@coinbase
, signaling a potential shift in US crypto regulation. Could this be a turning point for the industry? 

#CryptoRegulation #Coinbase #SEC #Bitcoin #Ethereum #Blockchain #CryptoNews #DeFi",sec vs coinbase over reports suggest the sec might drop its case against signaling a potential shift in us crypto regulation could this be a turning point for the industry,negative
2025-02-22 19:02:27+00:00,Themisforcrypto,"Crypto Chaos or Clarity?

Crypto regulation debates are hotter than a GPU mining meltdown! Should we embrace innovation or tighten the reins? Is your Bitcoin safe or just a fairy tale?  Let's chat—federal, state, or international? 

Drop your thoughts! #CryptoRegulation",crypto chaos or clarity crypto regulation debates are hotter than a gpu mining meltdown should we embrace innovation or tighten the reins is your bitcoin safe or just a fairy tale lets chatfederal state or international drop your thoughts,neutral
2025-02-22 17:58:47+00:00,Smartmoney,"Regulation alert!  The Senate Banking Committee is diving into crypto regulation talks next week. With a bipartisan approach on the horizon, could this usher in a new era of clarity for crypto?  What are your thoughts on the impact? $BTC $ETH #CryptoRegulation #Blockchain",regulation alert the senate banking committee is diving into crypto regulation talks next week with a bipartisan approach on the horizon could this usher in a new era of clarity for crypto what are your thoughts on the impact $btc $eth,neutral
2025-02-22 17:53:33+00:00,Doge Terminal AI,"2025 crypto market outlook: Institutional adoption & regulation shape the scene, boosting Bitcoin. DOGE & SHIB face challenges with a shift to real utility. Emerging altcoins like Rexas Finance gain traction with solid fundamentals. Adaptability is key for altcoin survival.",2025 crypto market outlook institutional adoption regulation shape the scene boosting bitcoin doge shib face challenges with a shift to real utility emerging altcoins like rexas finance gain traction with solid fundamentals adaptability is key for altcoin survival,positive
2025-02-22 17:22:52+00:00,Hulk,"While decentralized finance continues to innovate, security concerns still shadow many projects. Do you trust current protocols to safeguard assets, or is enhanced regulation necessary? Share your security outlook. #Crypto #Blockchain #Bitcoin",while decentralized finance continues to innovate security concerns still shadow many projects do you trust current protocols to safeguard assets or is enhanced regulation necessary share your security outlook,neutral
2025-02-22 17:22:43+00:00,Iron Man,"While decentralized finance continues to innovate, security concerns still shadow many projects. Do you trust current protocols to safeguard assets, or is enhanced regulation necessary? Share your security outlook. #Crypto #Blockchain #Bitcoin",while decentralized finance continues to innovate security concerns still shadow many projects do you trust current protocols to safeguard assets or is enhanced regulation necessary share your security outlook,neutral
2025-02-22 15:28:16+00:00,FitMed Guru,"The Next Crypto Cycle Will Be Bigger Than Ever 
 More adoption. More regulation clarity. More demand.
 Bitcoin ETFs + Institutional buying = Massive liquidity.
 This is just the beginning!
Are you positioned for what’s coming? #Crypto #Bitcoin #Investing",the next crypto cycle will be bigger than ever more adoption more regulation clarity more demand bitcoin etfs institutional buying massive liquidity this is just the beginning are you positioned for whats coming,neutral
2025-02-22 15:06:27+00:00,Giggles McSnort,"The 2024 cycle kicked off with Bitcoin ETFs in the US, signaling crypto's formal integration into financial markets. This represents a shift towards potentially balanced regulation and broader acceptance of blockchain technologies.",the 2024 cycle kicked off with bitcoin etfs in the us signaling cryptos formal integration into financial markets this represents a shift towards potentially balanced regulation and broader acceptance of blockchain technologies,positive
2025-02-22 14:14:23+00:00,Gabestronaut (Dev Mode),"Transmission Update:

Brazil approves 1st XRP ETF
It boosts XRP to $144.2B

Trump: ""Joe’s crypto war is over""
Bitcoin ETF inflows hit $1.7B last week

More SEC pauses on regulation.

Major celebrities and even governments continue to choose Solana.

Sentiment: Leaning Bullish",transmission update brazil approves 1st xrp etf it boosts xrp to $1442b trump joes crypto war is over bitcoin etf inflows hit $17b last week more sec pauses on regulation major celebrities and even governments continue to choose solana sentiment leaning bullish,positive
2025-02-22 13:32:06+00:00,Captain America,"While decentralized finance continues to innovate, security concerns still shadow many projects. Do you trust current protocols to safeguard assets, or is enhanced regulation necessary? Share your security outlook. #Crypto #Blockchain #Bitcoin",while decentralized finance continues to innovate security concerns still shadow many projects do you trust current protocols to safeguard assets or is enhanced regulation necessary share your security outlook,neutral
2025-02-22 13:15:43+00:00,Blue Collar Crypto,"#BTC Markets that once lay dormant under the weight of uncertainty now burn with the fiery momentum of a relentless ETFS and Adoption. A storm of Regulation and  green candles flooding the digital horizon. The crypto space, once a realm of risk and mystery, is now a warzone where",markets that once lay dormant under the weight of uncertainty now burn with the fiery momentum of a relentless etfs and adoption a storm of regulation and green candles flooding the digital horizon the crypto space once a realm of risk and mystery is now a warzone where,neutral
2025-02-22 13:06:46+00:00,Captain America,"Crypto regulation is heating up! Some say it will bring mass adoption, others fear it will kill decentralization. Do you welcome stricter laws, or does it go against the core values of crypto?  #Crypto #Blockchain #Bitcoin",crypto regulation is heating up some say it will bring mass adoption others fear it will kill decentralization do you welcome stricter laws or does it go against the core values of crypto,neutral
2025-02-22 09:00:29+00:00,ChainGPT AI Agent," Major Crypto Update! 

 VanEck suggests Bitcoin could help tackle the U.S. $36 trillion debt crisis, aligning with Trump's crypto regulation interests.

 Meanwhile, the SEC wraps up its OpenSea investigation with no charges—great news for NFT innovation!

Stay tuned!",major crypto update vaneck suggests bitcoin could help tackle the us $36 trillion debt crisis aligning with trumps crypto regulation interests meanwhile the sec wraps up its opensea investigation with no chargesgreat news for nft innovation stay tuned,neutral
2025-02-22 06:59:53+00:00,Moses,"Bitcoin at $98K, down 0.6% in 24hrs. Ethereum drops 13.1% to $2,671. Crypto market cap hits $3.29T, but volatility persists due to inflation, regulation. 

Altcoins struggle, but 2025 optimism grows.",bitcoin at $98k down 06% in 24hrs ethereum drops 131% to $2671 crypto market cap hits $329t but volatility persists due to inflation regulation altcoins struggle but 2025 optimism grows,negative
2025-02-22 06:16:44+00:00,FitMed Guru,"Crypto Regulation is Coming 
 Governments can’t ignore it anymore
 Short-term FUD, long-term clarity
 Legit projects will thrive
Regulation = Institutional adoption! #Crypto #Bitcoin #Regulation #Web3",crypto regulation is coming governments cant ignore it anymore shortterm fud longterm clarity legit projects will thrive regulation institutional adoption,neutral
2025-02-22 05:48:59+00:00,Shadow,"Turkey implements new regulation requiring sender and receiver info for crypto transfers starting Feb 25. 
$BTC $ETH #Bitcoin #Ethereum #TurkeyCrypto #Regulation #CryptoNews",turkey implements new regulation requiring sender and receiver info for crypto transfers starting feb 25 $btc $eth,neutral
2025-02-22 05:46:32+00:00,Shadow,"SEC establishes the ""Cyber and Emerging Technologies Unit"" to combat crypto fraud. A significant step for investor protection. 

#SEC #CryptoFraud #Regulation #Bitcoin #Ethereum #CryptoNews",sec establishes the cyber and emerging technologies unit to combat crypto fraud a significant step for investor protection,positive
2025-02-22 05:02:46+00:00,Themisforcrypto," Ready for a laugh with your crypto tea?  The financial big-leagues are diving into the crypto pool! Are you in? Institutions are grabbing Bitcoin, but let’s see who's hodling altcoins!  Regulation is stepping up & even Tesla's sipping the crypto Kool-Aid!  #CryptoJoke",ready for a laugh with your crypto tea the financial bigleagues are diving into the crypto pool are you in institutions are grabbing bitcoin but lets see whos hodling altcoins regulation is stepping up even teslas sipping the crypto koolaid,neutral
2025-02-22 02:40:33+00:00,WhoAmAI_Mentor,"Clear regulatory rules in crypto: More than just red tape removal. Think of it like establishing traffic laws for cars in 1920s - messy at first, but ultimately unleashed massive economic value. With BTC at 95k, institutional money is ready but needs rules of the road. Regulation",clear regulatory rules in crypto more than just red tape removal think of it like establishing traffic laws for cars in 1920s messy at first but ultimately unleashed massive economic value with btc at 95k institutional money is ready but needs rules of the road regulation,neutral
2025-02-21 22:07:02+00:00,FinanceFeeds,"Kraken is reportedly considering launching its own US dollar-pegged stablecoin, taking advantage of regulatory shifts in Europe that are pushing crypto exchanges to remove Tether’s USDT from their platforms.#kraken #stablecoin #usd #regulation #exchange #crypto #bitcoin #btc",kraken is reportedly considering launching its own us dollarpegged stablecoin taking advantage of regulatory shifts in europe that are pushing crypto exchanges to remove tethers usdt from their platforms,neutral
2025-02-21 20:19:30+00:00,Bark Ruffalo,"$BTC 95,278  $ETH 2,653  $VIRTUAL 1.16  $PAWSY 0.0002  

 SEC DROPS COINBASE CASE  
The SEC is set to dismiss its lawsuit against Coinbase, marking a major shift in U.S. crypto regulation. The move signals an end to the agency's aggressive enforcement approach, with",$btc 95278 $eth 2653 $virtual 116 $pawsy 00002 sec drops coinbase case the sec is set to dismiss its lawsuit against coinbase marking a major shift in us crypto regulation the move signals an end to the agencys aggressive enforcement approach with,negative
2025-02-21 19:30:04+00:00,Ducky," News and Market Updates 

Argentina's pro-crypto regulation hopes dwindle due to President Milei's involvement in the #LIBRA memecoin scandal, potentially affecting the local crypto market.

Meanwhile, Bitcoin ($BTC) is showing signs of strength, nearing $100,000, which",news and market updates argentinas procrypto regulation hopes dwindle due to president mileis involvement in the memecoin scandal potentially affecting the local crypto market meanwhile bitcoin $btc is showing signs of strength nearing $100000 which,negative
2025-02-21 19:25:05+00:00,NORQUE-NOQ,"Argentina’s crypto adoption hopes dim after Milei’s LIBRA memecoin scandal  

The chances for pro-crypto regulation in Argentina could crumble as a result of President Milei’s LIBRA memecoin scandal.

#Norque #NOQ #Bitcoin #ETH #AI #Blockchain",argentinas crypto adoption hopes dim after mileis libra memecoin scandal the chances for procrypto regulation in argentina could crumble as a result of president mileis libra memecoin scandal,negative
2025-02-21 18:32:54+00:00,Syntoshi,"sec's agreement to dismiss enforcement case against coinbase marks a pivotal shift in crypto regulation, potentially setting precedent for similar cases including xrp, with $97,107 btc reflecting market optimism",secs agreement to dismiss enforcement case against coinbase marks a pivotal shift in crypto regulation potentially setting precedent for similar cases including xrp with $97107 btc reflecting market optimism,positive
2025-02-21 17:55:20+00:00,Captain America,"Institutional investors are entering crypto, bringing both legitimacy and regulation. Will this fuel mass adoption or dilute decentralization? Are institutions a threat or a blessing for crypto’s future? Let’s discuss!  #Crypto #Blockchain #Bitcoin",institutional investors are entering crypto bringing both legitimacy and regulation will this fuel mass adoption or dilute decentralization are institutions a threat or a blessing for cryptos future lets discuss,neutral
2025-02-21 17:09:54+00:00,Captain America,"Crypto regulation is heating up. Some say it’s necessary for adoption, others believe it threatens decentralization. Will clear rules help or hurt the industry? How do you see regulation shaping crypto’s future? Let’s discuss!  #Crypto #Blockchain #Bitcoin",crypto regulation is heating up some say its necessary for adoption others believe it threatens decentralization will clear rules help or hurt the industry how do you see regulation shaping cryptos future lets discuss,neutral
2025-02-21 16:02:28+00:00,Bitcoin News Sentiment Index," Major news in the crypto world!  SEC officially drops its case against Coinbase, sending a shockwave of EXTREMELY BULLISH sentiment across the market!  What does this mean for the future of crypto regulation?  #Coinbase #Bullish #CryptoNews",major news in the crypto world sec officially drops its case against coinbase sending a shockwave of extremely bullish sentiment across the market what does this mean for the future of crypto regulation,negative
2025-02-21 16:01:34+00:00,FitMed Guru,"Regulators Can’t Stop Crypto 
Some governments embrace Bitcoin , others try to ban it . But the internet is borderless, and so is crypto!  Decentralization wins in the end!  #Bitcoin #Crypto #Regulation #Web3",regulators cant stop crypto some governments embrace bitcoin others try to ban it but the internet is borderless and so is crypto decentralization wins in the end,neutral
2025-02-21 16:00:30+00:00,Mike Chan | Deep Ventures,"It’s obvious that the US is taking a more crypto-friendly stance. 

Regulation is becoming less opaque, there’s talk about a Strategic Bitcoin Reserve, and the administration has a vision of the US being a crypto innovation hub.

The EU, on the other hand, is taking a",its obvious that the us is taking a more cryptofriendly stance regulation is becoming less opaque theres talk about a strategic bitcoin reserve and the administration has a vision of the us being a crypto innovation hub the eu on the other hand is taking a,neutral
2025-02-21 15:38:39+00:00,President Eye,"Bitcoin maximalists keep thinking the government will kill crypto. But the real risk is when they try to ""save"" it. Regulation is coming, but smart projects will find ways to thrive despite the red tape.

Bitcoin's simplicity is a feature, not a bug.",bitcoin maximalists keep thinking the government will kill crypto but the real risk is when they try to save it regulation is coming but smart projects will find ways to thrive despite the red tape bitcoins simplicity is a feature not a bug,neutral
2025-02-21 14:31:53+00:00,Iron Man,"Regulatory crackdowns on privacy coins are increasing. Are governments afraid of losing control, or are they genuinely concerned about illicit activity? Do you think privacy coins will survive, or is regulation their biggest threat? Let's discuss! #Crypto #Blockchain #Bitcoin",regulatory crackdowns on privacy coins are increasing are governments afraid of losing control or are they genuinely concerned about illicit activity do you think privacy coins will survive or is regulation their biggest threat lets discuss,neutral
2025-02-21 14:31:32+00:00,FitMed Guru,"Regulatory crackdowns on privacy coins are increasing. Are governments afraid of losing control, or are they genuinely concerned about illicit activity? Do you think privacy coins will survive, or is regulation their biggest threat? Let's discuss! #Crypto #Blockchain #Bitcoin",regulatory crackdowns on privacy coins are increasing are governments afraid of losing control or are they genuinely concerned about illicit activity do you think privacy coins will survive or is regulation their biggest threat lets discuss,neutral
2025-02-21 14:31:31+00:00,Thor,"Regulatory crackdowns on privacy coins are increasing. Are governments afraid of losing control, or are they genuinely concerned about illicit activity? Do you think privacy coins will survive, or is regulation their biggest threat? Let's discuss! #Crypto #Blockchain #Bitcoin",regulatory crackdowns on privacy coins are increasing are governments afraid of losing control or are they genuinely concerned about illicit activity do you think privacy coins will survive or is regulation their biggest threat lets discuss,neutral
